{
  "version": "2026-06-21.agent-workspace-contract",
  "name": "Agent Workspace Prototype Canvas Contract",
  "source": {
    "type": "ascii",
    "path": ".myagenttool/runs/orca-inspired-agent-workspace-ui/agent-workspace-ascii-prototype.md"
  },
  "productFlow": {
    "roleFlow": "ordinary developer, advanced developer, team administrator, auditor",
    "scenario": "Navigate a managed agent workspace without mixing task input, session supervision, runtime terminal, evidence, approval, or setup concerns.",
    "frequency": "high for Run, medium for Session/Diff/Terminal, low but critical for Evidence/Approval/Setup",
    "ownerSurface": "Agent Workspace shell with Run-first center surface and contextual right rail",
    "usabilityTask": "Review the Run-first workspace shell and confirm advanced surfaces stay separated.",
    "partialAcceptanceOrFollowUp": "Phase C will implement the production Web Console workspace shell."
  },
  "canvas": {
    "coordinateSystem": "infinite",
    "viewport": {
      "x": 0,
      "y": 0,
      "width": 1560,
      "height": 1720
    },
    "grid": {
      "size": 24,
      "visible": true
    }
  },
  "surfaces": [
    {
      "id": "run-workspace",
      "name": "Run Workspace",
      "kind": "home",
      "role": "ordinary_developer",
      "productFlow": {
        "roleFlow": "ordinary developer",
        "scenario": "Run a managed agent task from a clean first screen.",
        "frequency": "high",
        "ownerSurface": "Run-first Agent Workspace shell",
        "usabilityTask": "Type a task, choose computer and agent, review safety, and run without seeing advanced governance internals.",
        "partialAcceptanceOrFollowUp": "Phase C will implement the production shell and state wiring."
      },
      "prototypeStates": [
        "ready",
        "running",
        "approval_needed",
        "succeeded_with_changes"
      ],
      "acceptanceSignals": [
        "Findable: Run is the default active surface.",
        "Understandable: task, status, and context rail are separated.",
        "Actionable: run, cancel, approve/deny, review diff, and open session appear only when relevant.",
        "Traceable: session and evidence summaries are reachable from the context rail."
      ],
      "whatNotToShow": [
        "raw terminal",
        "raw JSONL",
        "hook names",
        "imported evidence workflow",
        "integration builder",
        "full session turns",
        "approval inbox",
        "private Codex files"
      ],
      "bounds": {
        "x": 0,
        "y": 0,
        "width": 1420,
        "height": 720
      },
      "regions": [
        {
          "id": "run-composer",
          "name": "Run Task Composer",
          "ownerSurface": "Run surface",
          "frequency": "high",
          "role": "ordinary_developer",
          "productFlow": {
            "roleFlow": "ordinary developer",
            "scenario": "Describe and start a managed agent task.",
            "frequency": "high",
            "ownerSurface": "Run surface",
            "usabilityTask": "Type task, select computer and agent, select session mode, and run.",
            "partialAcceptanceOrFollowUp": "Generated by ASCII import; later gates may refine layout and labels."
          },
          "prototypeStates": [
            "ready",
            "running_disabled",
            "approval_visible",
            "succeeded_ready_for_next"
          ],
          "acceptanceSignals": [
            "Findable: task input is first in Run.",
            "Understandable: computer, agent, and session mode are visible.",
            "Actionable: run and cancel are clearly separated."
          ],
          "whatNotToShow": [
            "raw terminal",
            "raw JSONL",
            "hook names",
            "imported evidence workflow",
            "integration builder",
            "full session turns",
            "approval inbox",
            "private Codex files"
          ],
          "bounds": {
            "x": 232,
            "y": 72,
            "width": 440,
            "height": 560
          },
          "elements": [
            {
              "id": "what-should-your-computer-do",
              "type": "textarea",
              "label": "What should your computer do?",
              "bounds": {
                "x": 256,
                "y": 104,
                "width": 392,
                "height": 88
              }
            },
            {
              "id": "agent",
              "type": "select",
              "label": "Agent: Codex CLI",
              "bounds": {
                "x": 256,
                "y": 152,
                "width": 392,
                "height": 36
              }
            },
            {
              "id": "run",
              "type": "button",
              "label": "Run",
              "variant": "primary",
              "bounds": {
                "x": 256,
                "y": 200,
                "width": 392,
                "height": 36
              }
            }
          ]
        }
      ]
    }
  ]
}
